{
  "oaff_version": "0.1.0",
  "finding": {
    "id": "tag:example.org,2026:oaff/finding/conflict-1",
    "revision": "tag:example.org,2026:oaff/revision/conflict-1",
    "statement": "The synthetic API returns the original resource identifier on retry.",
    "type": "observation",
    "applicability": {
      "description": "Synthetic API create calls after an ambiguous timeout.",
      "conditions": [
        "API v2",
        "The retry uses the identical idempotency key."
      ],
      "exclusions": [
        "No idempotency key was supplied."
      ]
    },
    "producer": {
      "id": "tag:example.org,2026:agent/researcher",
      "kind": "agent"
    },
    "created_at": "2026-09-29T12:00:00Z",
    "evidence": [
      {
        "id": "run-42",
        "source_uri": "https://example.org/runs/42",
        "content_digest": {
          "algorithm": "sha-256",
          "value": "28a181837f8e9071ddbd86007509ba423350988f9abc7377d851ea2ae3d7f8bd"
        },
        "availability": "restricted",
        "locator": "attempt 2 / result",
        "excerpt": "Synthetic example: one resource identifier observed after retry."
      },
      {
        "id": "run-43",
        "source_uri": "https://example.org/runs/43",
        "content_digest": {
          "algorithm": "sha-256",
          "value": "50a7d0d44480d9854e106b2f853b47f37f508f3f5a6e674e2f0dab4a356497f4"
        },
        "availability": "restricted",
        "excerpt": "Synthetic counterexample: a new resource identifier was observed."
      }
    ]
  },
  "receipts": [
    {
      "id": "tag:example.org,2026:oaff/receipt/conflict-check",
      "kind": "support_assessment",
      "subject_revision": "tag:example.org,2026:oaff/revision/conflict-1",
      "issuer": {
        "id": "tag:example.org,2026:agent/reviewer",
        "kind": "agent"
      },
      "issued_at": "2026-09-29T13:00:00Z",
      "method": "synthetic-conflict-screen/v1",
      "result": "indeterminate",
      "evidence_refs": [
        "run-42",
        "run-43"
      ]
    }
  ],
  "integrity": {
    "algorithm": "sha-256-jcs",
    "digest": "9261b2591de6c2dbd7475b08ea58eb372b4b1b037e1d8a74d9b7d68a8f9cc5b9"
  }
}
