{
  "oaff_version": "0.1.0",
  "finding": {
    "id": "tag:example.org,2026:oaff/finding/retry-42",
    "revision": "tag:example.org,2026:oaff/revision/retry-42-v2",
    "statement": "In the synthetic API v2 run, retrying create with the same idempotency key returned the original resource identifier.",
    "type": "observation",
    "applicability": {
      "description": "Synthetic API create calls after an ambiguous timeout.",
      "conditions": [
        "API v2",
        "The retry uses the identical idempotency key."
      ],
      "exclusions": [
        "No idempotency key was supplied."
      ]
    },
    "producer": {
      "id": "tag:example.org,2026:agent/researcher",
      "kind": "agent"
    },
    "created_at": "2026-09-29T12:00:00Z",
    "evidence": [
      {
        "id": "run-42",
        "source_uri": "https://example.org/runs/42",
        "content_digest": {
          "algorithm": "sha-256",
          "value": "28a181837f8e9071ddbd86007509ba423350988f9abc7377d851ea2ae3d7f8bd"
        },
        "availability": "restricted",
        "locator": "attempt 2 / result",
        "excerpt": "Synthetic example: one resource identifier observed after retry."
      }
    ],
    "links": [
      {
        "relation": "revision_of",
        "target_id": "tag:example.org,2026:oaff/finding/retry-42",
        "target_revision": "tag:example.org,2026:oaff/revision/retry-42-v1"
      }
    ]
  },
  "receipts": [],
  "integrity": {
    "algorithm": "sha-256-jcs",
    "digest": "1bcac25f1e4a82424117bb1ffdc3f69957dc55823ade27a5ec247f3a5358c35d"
  }
}
